{
  "schemaVersion": 1,
  "factions": [
    {
      "id": "space-marines",
      "name": "Space Marines",
      "alliance": "order",
      "armies": [
        {
          "id": "space-marines-combat-patrol",
          "name": "Strike Force Octavius",
          "general": "Captain Octavius",
          "tagline": "Leviathan box Terminator spearhead — Oath of Moment and deep strike",
          "playstyle": "Terminators and Infernus Marines hold the line while Captain Octavius and Librarian Tantus strike objectives. Oath of Moment lets you focus fire on one priority target each Command phase.",
          "unitCount": 12,
          "roster": [
            "Captain Octavius",
            "Librarian Tantus",
            "5 Terminators",
            "5 Infernus Marines"
          ],
          "battleTraitName": "Oath of Moment",
          "officialRulesURL": "https://warhammer40000.com/wp-content/uploads/2023/06/xw27iUOHPKXBNDnG.pdf",
          "battleTraits": [
            {
              "id": "oath-of-moment",
              "name": "Oath of Moment",
              "summary": "In your Command phase, pick one enemy unit. Until your next Command phase, that unit is your Oath of Moment target and you re-roll Hit rolls against it.",
              "timing": "Each Command phase"
            }
          ],
          "enhancements": [
            {
              "id": "champion-duellist",
              "name": "Champion Duellist",
              "summary": "Gives Captain Octavius extra melee prowess — re-roll Hit rolls in Fight and +1 Attack on his melee weapons.",
              "newPlayerHint": "Recommended first game — the default Leviathan enhancement.",
              "timing": "Pre-battle — default Enhancement"
            },
            {
              "id": "oathsworn-determination",
              "name": "Oathsworn Determination",
              "summary": "Optional Warlord upgrade — swap from Champion Duellist before battle if you want a different plan.",
              "newPlayerHint": "Try once you know how Octavius fights on the table.",
              "timing": "Pre-battle — optional Enhancement"
            }
          ],
          "secondaryObjectives": [
            {
              "id": "wrath-of-the-emperor",
              "name": "Wrath of the Emperor",
              "summary": "At the end of each phase, score 2 VP if Captain Octavius destroyed one or more enemy models that phase.",
              "newPlayerHint": "Default pick — send your Captain into the fight.",
              "timing": "End of each phase"
            },
            {
              "id": "shock-tactics",
              "name": "Shock Tactics",
              "summary": "At the end of your turn, score 5 VP if you control one or more objectives your opponent controlled at the start of that turn.",
              "newPlayerHint": "Objective-flip plan for mobile Terminators.",
              "timing": "End of your turn"
            }
          ],
          "stratagems": [
            {
              "id": "gene-wrought-resilience",
              "name": "Gene-wrought Resilience",
              "summary": "When targeted, subtract 1 from Wound rolls if the attack's Strength exceeds your unit's Toughness.",
              "cpCost": 1,
              "phase": "Shooting or Fight",
              "isReactive": true
            },
            {
              "id": "veteran-instincts",
              "name": "Veteran Instincts",
              "summary": "Re-roll Wound rolls of 1 in Fight; re-roll all Wounds vs Monsters or Vehicles.",
              "cpCost": 1,
              "phase": "Fight"
            },
            {
              "id": "duty-and-honour",
              "name": "Duty and Honour",
              "summary": "At end of Command, lock an objective you control even after moving off it.",
              "cpCost": 1,
              "phase": "Command"
            }
          ]
        }
      ]
    },
    {
      "id": "adepta-sororitas",
      "name": "Adepta Sororitas",
      "alliance": "order",
      "armies": []
    },
    {
      "id": "adeptus-custodes",
      "name": "Adeptus Custodes",
      "alliance": "order",
      "armies": []
    },
    {
      "id": "adeptus-mechanicus",
      "name": "Adeptus Mechanicus",
      "alliance": "order",
      "armies": []
    },
    {
      "id": "astra-militarum",
      "name": "Astra Militarum",
      "alliance": "order",
      "armies": []
    },
    {
      "id": "grey-knights",
      "name": "Grey Knights",
      "alliance": "order",
      "armies": []
    },
    {
      "id": "imperial-agents",
      "name": "Imperial Agents",
      "alliance": "order",
      "armies": []
    },
    {
      "id": "imperial-knights",
      "name": "Imperial Knights",
      "alliance": "order",
      "armies": []
    },
    {
      "id": "chaos-space-marines",
      "name": "Chaos Space Marines",
      "alliance": "chaos",
      "armies": []
    },
    {
      "id": "chaos-daemons",
      "name": "Chaos Daemons",
      "alliance": "chaos",
      "armies": []
    },
    {
      "id": "chaos-knights",
      "name": "Chaos Knights",
      "alliance": "chaos",
      "armies": []
    },
    {
      "id": "death-guard",
      "name": "Death Guard",
      "alliance": "chaos",
      "armies": []
    },
    {
      "id": "emperors-children",
      "name": "Emperor's Children",
      "alliance": "chaos",
      "armies": []
    },
    {
      "id": "thousand-sons",
      "name": "Thousand Sons",
      "alliance": "chaos",
      "armies": []
    },
    {
      "id": "world-eaters",
      "name": "World Eaters",
      "alliance": "chaos",
      "armies": []
    },
    {
      "id": "orks",
      "name": "Orks",
      "alliance": "destruction",
      "armies": []
    },
    {
      "id": "aeldari",
      "name": "Aeldari",
      "alliance": "destruction",
      "armies": []
    },
    {
      "id": "drukhari",
      "name": "Drukhari",
      "alliance": "destruction",
      "armies": []
    },
    {
      "id": "genestealer-cults",
      "name": "Genestealer Cults",
      "alliance": "destruction",
      "armies": []
    },
    {
      "id": "leagues-of-votann",
      "name": "Leagues of Votann",
      "alliance": "destruction",
      "armies": []
    },
    {
      "id": "necrons",
      "name": "Necrons",
      "alliance": "destruction",
      "armies": []
    },
    {
      "id": "tau-empire",
      "name": "T'au Empire",
      "alliance": "destruction",
      "armies": []
    },
    {
      "id": "tyranids",
      "name": "Tyranids",
      "alliance": "destruction",
      "armies": [
        {
          "id": "tyranids-combat-patrol",
          "name": "The Vardenghast Swarm",
          "general": "Terror of Vardenghast",
          "tagline": "Leviathan box swarm — Synapse, deep strike, and teeming Termagants",
          "playstyle": "Termagants and Barbgaunts flood objectives while the Winged Prime and Psychophage hit weak points. Von Ryan's Leapers infiltrate and the Teeming Broods stratagem can recycle Termagants.",
          "unitCount": 30,
          "roster": [
            "Terror of Vardenghast (Winged Tyranid Prime)",
            "Psychophage",
            "20 Termagants",
            "5 Barbgaunts",
            "3 Von Ryan's Leapers"
          ],
          "battleTraitName": "Synapse",
          "officialRulesURL": "https://warhammer40000.com/wp-content/uploads/2023/06/lbmtxXmWRsCoIL5m.pdf",
          "battleTraits": [
            {
              "id": "synapse",
              "name": "Synapse",
              "summary": "Tyranids units within 6\" of a Synapse model take Battle-shock tests on 3D6 instead of 2D6.",
              "timing": "Passive"
            },
            {
              "id": "shadow-in-the-warp",
              "name": "Shadow in the Warp",
              "summary": "Once per battle in either Command phase, each enemy unit takes a Battle-shock test.",
              "timing": "Once per battle, Command phase"
            }
          ],
          "enhancements": [
            {
              "id": "psychostatic-veil",
              "name": "Psychostatic Veil",
              "summary": "Default — Terror of Vardenghast gains Lone Operative, 4+ invulnerable save, and -1 to Hit in melee against the bearer.",
              "newPlayerHint": "Safest first-game pick for a flying Warlord.",
              "timing": "Pre-battle — default Enhancement"
            },
            {
              "id": "secretion-goad",
              "name": "Secretion Goad",
              "summary": "Once per turn, a friendly Tyranids unit within 6\" improves AP by 1 when selected to shoot or fight.",
              "newPlayerHint": "Aggressive pick when Barbgaunts or Termagants need to punch through.",
              "timing": "Pre-battle — optional Enhancement"
            }
          ],
          "secondaryObjectives": [
            {
              "id": "alpha-xenoform",
              "name": "Alpha Xenoform",
              "summary": "At the end of each phase, score 4 VP if your Winged Tyranid Prime destroyed one or more enemy models that phase.",
              "newPlayerHint": "Default — hunt with the Terror of Vardenghast.",
              "timing": "End of each phase"
            },
            {
              "id": "chitinous-tide",
              "name": "Chitinous Tide",
              "summary": "At the end of your turn, score 5 VP if you control objectives within 6\" of the opponent's deployment zone.",
              "newPlayerHint": "Push Termagants deep for board control.",
              "timing": "End of your turn"
            }
          ],
          "stratagems": [
            {
              "id": "hyper-reactive",
              "name": "Hyper-reactive",
              "summary": "When targeted, subtract 1 from Hit rolls against your Infantry unit.",
              "cpCost": 1,
              "phase": "Shooting or Fight",
              "isReactive": true
            },
            {
              "id": "voracious-assault",